{"$schema":"https://json-schema.org/draft/2020-12/schema","title":"QGR preregistration v1","type":"object","required":["scientific_question","parent_authority","immutable_inputs","allowed_transformations","forbidden_tuning","producer","independent_critic","negative_controls","terminal_classes","provenance","claim_ceiling","next_decision_tree"],"properties":{"scientific_question":{"type":"string","minLength":1},"parent_authority":{"type":"string","minLength":1},"immutable_inputs":{"type":"array"},"allowed_transformations":{"type":"array"},"forbidden_tuning":{"type":"array"},"producer":{"type":"string","minLength":1},"independent_critic":{"type":"string","minLength":1},"negative_controls":{"type":"array"},"terminal_classes":{"type":"object","required":["PASS","FAIL","BLOCKED","INVALID"]},"provenance":{"type":"object"},"claim_ceiling":{"type":"string","minLength":1},"next_decision_tree":{"type":"object"}}}
