{"scientific_question":"REQUIRED","parent_authority":"REQUIRED","immutable_inputs":[],"allowed_transformations":[],"forbidden_tuning":[],"producer":"QGR_PRODUCER","independent_critic":"INDEPENDENT_CRITIC","negative_controls":[],"terminal_classes":{"PASS":"FROZEN_PASS_CLASS","FAIL":"FROZEN_FAIL_CLASS","BLOCKED":"FROZEN_BLOCKED_CLASS","INVALID":"FROZEN_INVALID_CLASS"},"provenance":{"parent_sha":"REQUIRED"},"claim_ceiling":"SCOPED_ONLY","next_decision_tree":{"on_PASS":"REQUIRED","on_FAIL":"REQUIRED","on_BLOCKED":"REQUIRED","on_INVALID":"REQUIRED"}}
